{
  "schemaVersion": "0.1.0",
  "id": "00000000-0000-0000-0000-000000000301",
  "sourceFingerprint": "aabbccddeeff00112233445566778899aabbccddeeff00112233445566778899",
  "resources": {
    "resources": [
      {
        "id": "01J5M1FXTRRESR00000000000R",
        "kind": "EMBEDDED_IMAGE",
        "mediaType": "image/png",
        "byteLength": 1234,
        "sha256": "8899aabbccddeeff00112233445566778899aabbccddeeff001122334455667788",
        "origin": "EXTRACTED"
      }
    ]
  },
  "provenanceIds": []
}
